<?xml version="1.0" encoding="UTF-8" standalone="no" ?>

<!-- Table mapping names to @Serialzable uids. -->
<tables xmlns="http://www.w3schools.com" xmlns:xsi="http://www.w3.org/2001/XMLSchema-instance"
    xsi:schemaLocation="http://www.w3schools.com tables.xsd">

    <table name="mst_bundle_version" uid="0x6a0acd69ac1a6c" />
    <table name="mst_country" uid="0x61175aa6b510b3" />
    <table name="mst_holiday_ctrl" uid="0x56c4d6ff7b69dc" pkuid="0x0bef5f538e4ed9" />
    <table name="mst_route" uid="0xef6d8232d3263d" />
    <table name="mst_routing_layer" uid="0x92ed6a2fc3f79f" />
    <table name="mst_sector" uid="0xf1dec2bb66db87" pkuid="0xd432b301532a4a" />
    <table name="mst_station" uid="0x1f6229f711c472" />
    <table name="mst_station_sector" uid="0x0d1eaebfd81899" pkuid="0x4a81cc447bdc43" />
    <table name="sys_property" uid="0xaa946790064006" pkuid="0x72b4356618387dL" />
</tables>
